{
  "date": "2026-04-26",
  "generated_at": "2026-04-26T01:29:14+09:00",
  "inputs": {
    "news": {
      "headline_count": 20,
      "summary": "米株ニュースは、インテル主導のハイテク買いでS&P500とナスダックの最高値更新が続く一方、イラン情勢と原油高、過熱警戒が重荷として残るという強気優勢の内容が中心。",
      "detailed_summary": "見出し全体では、インテルの好決算後の急騰をきっかけに半導体と大型ハイテクが買われ、S&P500とナスダックの最高値更新が繰り返し報じられており、ニュースの基調はポジティブである。もっとも、イラン情勢の膠着や米・イラン協議再開期待、原油の100ドル超えとその後の反落が同時に材料視され、地政学とエネルギー価格が投資家心理を左右している。ダウの相対的弱さ、ソフトウェア株安、テスラ安、バリュエーション過熱への警戒も散見され、全面高ではなくテック主導の選別色が濃い。加えて、2026年相場の上振れ期待や主要企業決算への注目も示され、全体像は不安材料を抱えつつも高値圏を維持する強気相場に集約される。",
      "top_headlines": [
        "インテル急騰でS&P500・ナスダック最高値",
        "テックラリー継続でもダウは相対軟調",
        "米・イラン協議再開期待で原油下落",
        "中東緊張と原油高で投資家心理不安定",
        "高値圏でも過熱警戒と強気見通しが併存"
      ],
      "notable_sources": [
        "Yahoo Finance UK",
        "CNBC",
        "Barron's",
        "WSJ",
        "MarketWatch"
      ],
      "macro_themes": [
        "半導体主導のテックラリー",
        "S&P500・ナスダック最高値更新",
        "米・イラン協議期待と中東地政学",
        "原油高と原油変動の市場影響",
        "高値警戒と強気見通しの併存"
      ],
      "sector_notes": [
        {
          "sector": "半導体",
          "tone": "positive",
          "drivers": [
            "インテル決算後急騰",
            "半導体主導の指数高値",
            "ナスダック上昇けん引"
          ]
        },
        {
          "sector": "ソフトウェア",
          "tone": "negative",
          "drivers": [
            "ソフトウェア株安",
            "テック内の選別売り"
          ]
        }
      ]
    },
    "market": {
      "availability": "unavailable"
    }
  },
  "analysis": {
    "summary": "米株はインテル起点の半導体高と主要指数の最高値更新で強気を維持する一方、中東情勢と原油変動、高値警戒が翌日の上値追いを左右する構図だ。",
    "market_bias": "bullish",
    "confidence": "medium",
    "macro_drivers": [
      "半導体主導高",
      "最高値更新",
      "インテル好決算",
      "大型ハイテク優位",
      "強気見通し"
    ],
    "risks": [
      "中東地政学",
      "原油変動",
      "高値警戒",
      "ダウ出遅れ",
      "テック内選別"
    ],
    "watch_items": [
      "米・イラン協議",
      "原油の方向感",
      "半導体ラリー持続",
      "主要企業決算",
      "ダウの追随"
    ]
  }
}
